item_category,item_id,brand,user_id,date,comment,rating,tonality
405,4050102,759,2947,2016-09-05,"С 17 июля '16г. этот вентилятор как включили на 3-ью скорость так он и работал до 12 августа - дома всегда кто-то находится, крутясь без остановки с поворотами (пока прохладно не стало на улице). За всё время было только два перерыва минут на 30. Мотор не грелся, шума - никакого. Стоит прочно, не шелохнувшись.    Много разных покупали и собирали вентилей (и кондишен есть, в этом году почти не включали, потому как в прошлом году все переболели из-за него) и про VITEK говорить, что кривой-расшатанный, - это странно, не верится. Полностью металлических вентилей нет уже, всё - пластмасса, частично немного металла.  У витека сборка - чёткая и простая, нигде ничего не люфтит и не раскачивается. Из-за отсутствия  люфтов он и работает бесшумно. VITEK - лучший в своем ценовом ряду. Это не Скарлет,  который только с пятого раза можно нормальный без косяков купить... Хотя цены, что на витек, что на скарлет, что на борк… и др.  – завышены. Пора снижать.",5,positive
103,1030105,592,783,2013-08-21,"Комплект отличный, купил себе в дуплет, мне всё оооочень нравится, отыгрывает на все 100%,басс просто шикарный,дребезжит всё что может дребезжать, мне говорили что усилок у них гавно, ниче подобного, всё отлично берите не пожалеете!)))",5,positive
207,2070202,877,2656,2010-12-19,"Хорошее звучание,стильный и удобные кнопки.",5,positive
406,4061001,76,767,2011-06-09,"Проработал около 2-х лет без нареканий и стала вытекать вода из-под стекла, хотя пользовались аккуратно, не били.  Регулятор очень удобный. Шумноват.",4,positive
401,4010301,13,8,2017-01-19,"В эксплуатации больше года. Особых нареканий не вызывает, со своими задачами справляется на ура. Выпечка в ней шикарна.  Шнур в комплекте, но без вилки. Это нормальная практика для всех духовых шкафов.",5,positive
303,3030501,1542,2815,2010-10-01,Этим должен обладать каждый владелец PS3!,5,positive
403,4030101,57,2141,2013-06-11,"Купили 8,06,13 года. Накопилось очень много вещей из-за того, что дважды поподался брак других производителей (Вернули в магазин) Спасибо indesit!!! Недорогая машина, а стирает очень хорошо и быстро!!!",4,positive
205,2050201,11,1026,2010-01-22,"телефон купил 15.01.2010 в м-видео.   начну с минусов.  1. поскрипывает панель сбоку.  2. не запускается аська (устанавливал с интернета).  3. при записи в телефонную книгу контакт сохраняется, но в телефонной книге его нет! очень удивился.  4. на 7 громкости (максимальная) хрипит динамик(    плюсы вы и так знаете, но тем не менее отмечу несколько:  1. батарея держит 2 дня при почти постоянном использовании как в режиме разговора, так и для личных целей (музыка, интернет, смс), хотя производителем заявлено 10 часов в режиме разговора.  стилусом не пользуюсь - лежит в коробке)  2. понравился дизайн тачфона.  3. нравиться меню.  4. камера хорошая.  5. отличный фонарь.    P.S. ловит (ттт) идеально.  вывод: телефон стоит своих денег, но это филипс.  удачи!",4,positive
406,4061102,64,2937,2010-01-11,Отличное изделие.  Приготовление всегда предсказуемо.   Жарит и печет равномерно .  Помимо противня умещает не хилую круглую сковороду (26 или 28 см кажется) за счет улубления в задней стенке.  Из минусов .. стальной корпус вечно в пятнах ))  Возможно занимает чуть многовато места на столе.,5,positive
405,4050101,759,2340,2010-07-14,"доволен!занимает мало места, отлично работает.особенно порадовал ионизатор воздуха и таймер.",5,positive
413,4130401,1466,1269,2013-05-28,"Мне его подарили, только он шел немного в другой комплектации. Он отработал 5 лет, сделан очень качественно, из приятной пластмассы и регулировка температур размещена очень удобно, да и волосы не выдергивает! Сейчас он сломался =( Но после 5 лет использования через день, это даже не обидно! =) Хочу взять той же фирмы, но с дисплеем температур.",5,positive
103,1030901,592,1557,2013-12-30,"Купил, поставил быстро, единственное дефлектор мешает, пришлось немного в сторону сдвинуть, что создает небольшой дискомфорт при посадке через эту дверь. Прием сигнала уверенный, часто езжу по России, так лучше не встречал.",5,positive
403,4030101,53,2937,2011-08-11,"Недавно приобрел эту машину. Выбирали очень долго (я вообще приверженец того, что хорошая техника не нуждается в рекламе, перерыли весь интернет и остановились на этой машине). Очень умный аппарат. Стирает просто великолепно. Все, что написано про бесшумный двигатель и безвибрационный отжим - абсолютная правда. Работа машины ночью абсолютно не мешает спать, ее просто не слышно (машинка стоит на кухне). Очень понравилось, что в процессе стирки машина ополаскивает кювету полностью и остатков моющего средства не остается. Если хотите получить удовольствие от покупки, тогда это машина для вас. Покупайте, не пожалеете.",5,positive
118,1180102,396,2923,2014-01-02,"Нормальный штатив при бережном отношении. Единственный минус - шарик с первого и  со второго раза не удается зафиксировать, так чтобы камера была ровно по уровню. Брал для видеокамеры, снимать сцены с пола . Цена оправданная. Главное при покупке смотрите, чтобы резиновые ножки не выпадали с посадочных мест.",4,positive
203,2030201,93,2656,2010-08-02,"Готов с вами поспорить, ноутбук очень хороший. И цена для ноутбука с такой производительностью очень даже приемлемая! Скорее всего это вам попался такой ноутбук. Если бы это была у него вечная проблема, тогда бы ещё несколько таких людей нашлось, почему то по отзывам, не только на этом сайте, я такой проблемы ни у кого не встречал.  Сам имею этот ноутбук, всё устраивает. Единственное только, что windows 7 home basic стоит, но это мелочи, кому надо и переустановит. Навязывать другим этот ноутбук я не буду, но если кто-то решил его приобрести, уверяю, вы не пожалеете! Ну, а доп гарантию я всё же советую взять, т.к никто ни от чего не застрахован! Смело даю ему 5 баллов!",5,positive
403,4030101,81,1851,2014-12-27,"Пишу еще, чтобы другие не наступали на эти же грабли. Транспортировочных болтов 3 штуки, верхний самый большой. Обязательно удаляйте и красную (думала заглушка или прокладка). Так вот она как раз длиной 5 см пластиковая и об нее стучит барабан при отжиме. Все удалила. Машинку почти не слышно!!! Рекомендую покупать!!!",5,positive
413,4130401,1466,2170,2010-08-16,"Я тоже осталась довольна! Устраивает всё: и качество, и цена ;) Советую!",5,positive
411,4110104,11,2960,2015-08-10,"Это действительно мощный пылесос и очень тихо работает по сравнению с другими. В магазине мне его продемонстрировали и у меня не осталось сомнений что это то, что мне нужно. Не пожалел нисколько о выборе. И кстати мешки сменные, это очень удобно, наполнился, выбросил и не нужно ничего трясти, мыть и т.п. Предыдущий так же был с мешками, поверьте, очень удобно!",5,positive
207,2070202,1008,580,2010-04-22,"Нормальный плеер, если разработать джойстик, то не придется тыкать по 200 раз, чтобы переключить песню. Звук отличный, единственное, конвертер хрень, постоянные несовпадения картинки и болтовни. Удобное меню, и достаточно памяти, чтобы закачать любимые песни. Не знаю как остальным, но мне нравится.",5,positive
410,4100201,64,1538,2017-02-18,"неприхотливость, капучинатор, европейское качество, можно найти запчасти на любой узел",4,positive
403,4030101,57,2170,2014-12-02,"Купила такую машинку в 2008 году, стирает отлично до сих пор, для маленькой семьи самое оно!!!",5,positive
401,4010201,709,767,2016-06-02,"Купил. Пока только могу сказать, что работает не шумно, тянет хорошо. Если включена на какую-нибудь скорость, то при выдвижении фильтра включается автоматически, а если задвинуть - выключается.  Минусов пока не обнаружил.  Заказывал через личный кабинет, получил СМС о том, что товар в магазине, приехал в магазин - получил и всё. Быстро и удобно.",5,positive
205,2050201,318,656,2011-05-04,"Хороший аппарат, пользуюсь более полугода, нареканий в работе  не было. На долго хватает батареи, динамик громкий, хороший дизайн, удобно держать в руке, радует новая ОС.  Из минусов - быстро облетает серебрянное напыление на джойстике и поверхность телефона почти всегда заляпана отпечатками. Ну и еще при ярком свете, например летом днем, очень плохо видно что на экране.",5,positive
404,4040106,829,690,2013-02-06,"Купили этот тепловентилятор несколько месяцев назад, пользуемся регулярно и очень довольны: комнату нагревает быстро,прост в эксплуатации, нет сильного шума и неприятного запаха + недорогой. Как раз то, что называется техника для реальной жизни. Всем советую, хороший прибор!",5,positive
203,2030201,534,257,2010-01-18,"Купила сегодня ноутбук!Просто в восторге от его многофункциональности!!!Посмотрим, как будет работать дальше!",5,positive
403,4030101,49,573,2010-02-04,"Стираем на ней ,уже больше года с учетом стирки детских вещей. Никаких проблем не было, стирает хорошо, есть удобный режим быстрой стирки, довольно тихая, словом, нам нравится ))",5,positive
412,4120101,759,551,2011-02-16,"Действительно, при заливании кипячёной воды, утюг в дальнейшем начнёт гладить с накипью. Всегда мучились с очисткой этого утюга. Насчёт того, что протекает вода, так не нужно заливать воды больше отметки МАХ. У нас этот утюг проработал 2 года и просто перестал нагреваться.",4,positive
207,2070202,668,656,2010-02-08,"Прикольный плеер. Качево звука хорошее! Видео еще лучше, если правильно кодировать!Конвертируйте видео в размер 320*240 через XvID в avi!  За эти деньги хорошая вещь! Все предельно просто!",5,positive
107,1070904,13,656,2010-06-04,"Аппарат хороший(по соотношению цена/качество). Он у меня второй после плазмы от Panasoniс 50'.   Эфир со спутника транслирует, хорошо, чуть уступая  вышеуказанной плазма, но лучше растягивает изображение формата 4:3. Отыгрывается в полный рост перед плазмой, при воспроизведении HD видео,сигнала с компьютера в разрешении 1920*1080 и другого видеосигнала с высоким битрейтом (спорить о преимуществах плазмы и ЖК не буду). Экран не бликует, а для моей комнаты это важно. Плазму(она у меня без антибликового покрытия) там солнечным днём смотреть не могу. Меню удобное с кучей настроек, простое. Имеет неплохой звук, для встроенных динамиков.Разнообразных входов/выходов достаточно. Мне, лично, хватает сполна для подключения одновременно всей имеющейся у меня аппаратуры. Из минусов могу отметить лишь легко царапающийся пластик, и то,что к нему сильно липнет пыль.",5,positive
403,4030101,57,968,2017-07-23,"Цена, простота, узкота.",5,positive
203,2030301,93,2006,2010-06-03,"Компьютер хорош!  Процессор летает, а не работает!  В общем всё отлично, не считая небольшого дребезжания после включения компьютера",5,positive
403,4030101,1425,1569,2011-06-15,"Машинка супер.  Управление: интуитивно понятное, инструкция нужна только чтобы узнать куда порошок засыпать и зачем дополнительная кювета.  Шум: супер тихая. Можно шёпотом разговаривать :)  Надёжность: пока не знаю.    Рекомендую.",5,positive
203,2030301,692,656,2010-08-23,"Купил в Марте пользуюсь...и очень даже нравится,правда Windows 7 домашняя базовая стояла,но я ее поменял на 7 Ultimate,а так все хорошо,пока не жалуюсь)))",5,positive
408,4080301,48,2815,2015-05-01,"Третий день в эксплуатации, в целом неплохо.  Один серьезный недостаток имеется все таки. Тупая инструкция. Куча ненужной информации, зато действительно необходимое проигнорировано. Режим быстрого нагрева, не указано время. Смысл тогда в нем, если нагревать можно и в других режимах. Отсутствие временных интервалов, очень серьезная оплошность",5,positive
404,4040105,617,1432,2009-10-05,"За свои денежки отличный товар, купил на распродаже, проветрил пару часов, и пользуюсь с удовольствием",5,positive
403,4030101,49,1046,2010-03-30,Отличная машина я рад этой покупке,5,positive
406,4061102,64,1861,2010-03-24,"Купили аппарат в январе, это реально мини-духовой шкаф!!!!! Есть все - конвекция, гриль, также часто пользуемся разморозкой, мясо и рыба, получается сочными! Очень  пригодился таймер и функция подогрева... Единственный минус - это все же - размер, занимает не мало места, хотя если сравнить сколько места занимает обычная плита (в т.ч. духовой шкаф) - это цветочки.....",5,positive
403,4030101,57,2951,2011-07-14,Купила машину Indesit wisn 100 два года назад. До сих пор отлично работает. Правда очень сильно шумит во время отжима. Но учитывая что это Российское производство. Так что шум браком не считаю. У знакомых такая же и тоже сильно шумит.,4,positive
411,4110102,81,1225,2010-01-25,"Первые впечатления - всё просто супер! Работает негромко, а тянет хорошо даже на малом режиме.",5,positive
404,4040203,725,257,2014-10-02,"Увлажнитель отличный. Но проработал 3 года. При аккуратном использовании, своевременной очистке и смене картриджа ежегодно, стоимость которого 800 рублей. Ремонт дорогой, закончился срок службы мембраны, по словам сервисного центра, частая причина.",5,positive
413,4130401,11,1869,2013-07-30,"Понравился. Волосы не пересушивает, мощность достаточная. Укладку им делаю без каких-либо проблем. У моей родственницы такой же, она собственно им тоже вполне довольна.",5,positive
404,4040104,64,2539,2013-12-18,"Сборка не КНР, а Россия.",5,positive
401,4010201,709,2489,2016-01-03,"Красота! Скоро год, как мы ее купили и вытяжка только радует своей производительностью)) Ее очень просто использовать, в управлении отсутствуют всякие ненужные навороты, все предельно ясно и даже без мануала можно понять принцип ее работы. Хорошо вписывается в любой интерьер, в нашем случае покупалась под деревянную кухню и выглядит в ансамбле с ней очень красиво))) Заметила, что реже стала протирать кафельные стены вокруг рабочей поверхности плиты - жир просто улетучивается после приготовления еды, кроме этого запахи тоже убирает на ура, особенно после жарки рыбы или мяса. Шум на первой скорости не беспокоит, но двойка и тройка уже громче работают, впрочем, звук вполне терпимый. Из недостатков только отпечатки пальцев на самой поверхности вытяжки беспокоят, но кроме этого все отлично))",5,positive
412,4120101,617,1869,2012-12-21,"Утюг хороший за такую цену. Пересушенные вещи без отпаривания не отутюжить, а так утюжит и отпаривает хорошо. Пластмассой не пахнет, но воду в нем оставлять после окончания работы не стоит, она вытекает.",4,positive
411,4110104,11,3172,2012-04-15,"Купили пылесос неделю назад!  Огромное спасибо продавцам - консультантам в \""М-Видео\""!  Теперь о пылесосе - отличная вещь! Пыль собирает на УРА!В доме маленький ребенок и животное, обожающее линять - то есть кошка, с предыдущим пылесосом такой чистоты не было, всю кошачью шерсть с ковров убрал. А турбо щетка это отдельная песня - ковры с длинным ворсом - ворс приподнимает и всю грязюку собирает. Таких чистых и если можно так сказать расчесанных ковров я не припомню. Про чистку турбо щетки - это не трудно - даже волосы длинные, вы же расческу простите за собой чистите! Про удары статического электричества - в инструкции об этом написано! И товарищи курс физики в школе вспомните и все вопросы отпадут - при такой мощности. Да конечно можно было бы и изоляцию где-то сделать или пылесосить только за пластиковую часть, но на полной мощности таки накапливает это электричество - я думаю у производителей все впереди. Попробовали пройтись на полной мощности по линолеуму - во время остановились - приподнимает!Конечно на вкус и цвет сойтись с кем либо сложно, а вот от меня пылесосу - спасибо!",5,positive
