item_category,item_id,brand,user_id,date,comment,rating,tonality
411,4110103,1050,2170,2017-05-18,Очень мощный. Чистит отлично.,5,positive
205,2050201,656,2923,2010-03-17,"Телефон очень классный, но для него очень мало тем и игр, особенно прошивок.",5,positive
413,4130701,10,1662,2010-08-21,"Бреюсь два года, имею жесткую щетину и раздражительную кожу.До этой бритвы бритьё казалось адом, Mach3-хватило лезвия на 2ва раза и то весь изрежешься и не пробреешься. Пробовал браун чуть получше лезвий, но раздражение. Панасоником бреюсь на сухую режущий блок пока не менял. Всем такую бритву советую.",5,positive
103,1030105,829,2624,2010-03-30,"Я себе поставил этот комплект и не о чем не пожелел. Очень классный комплект Mystery, покупайте не пожелеете.",5,positive
205,2050201,13,3106,2010-07-02,"купила недавно и очень рада!  превосходный телефон с прикольными сменными панелями.  яркий,модный,красивый,понятный и удобный. и т.д  неплохая камера не хуже чем у star:)  мало недостатков, хорошего в нём намного больше!  с каждым днём радует всё больше!  много доступа к интернету!  может заменить плеер)  ооочень хороший телефон!)  советую всем брать!и цена хорошая...)",5,positive
412,4120101,76,1440,2011-03-22,"Очень хороший!!!!!!!!!! была приятно удивлена тем, как легко и просто он гладит, точнее как разглаживает складки! сейчас у меня пора пеленок и хороший утюг сильно экономит время! я и раньше любила гладить белье, а теперь это просто наслаждение. надеюсь он прослужит долго!!!",5,positive
404,4040203,755,181,2010-01-28,"Куплен зимой для создания нормальной влажности в комнате. С задачей справляется на 100  на маленькой скорости, так как, чтоб ни говорили стоит гул на высокой, да она и не нужна для комнаты в 22 кв.м. Пыли стало гораздо меньше. Влажность 55 %. Сменный фильтр найти не проблема, стоит только достаточно дорого от 700р, в инете полно предложений. советую покупать.",4,positive
406,4061001,617,1217,2016-01-27,"Чайник с виду не плохой, чуток не понравилось, что крышка у него не много хлябает, ну это и понятно цена для качества не велика. Красивая синяя подсветка очень радует глаз, при первом кипячении пахло не понятно чем, хотя воду наливали через фильтр, думаю, что позже запах выветрится.ставлю 5 баллов только из за цены.",5,positive
103,1030304,795,2957,2009-09-28,"В общем аппарат хороший, настроек не очень много, но и не мало. Качество изображения, для экрана такого размера, на 5.  Качество звучания на 4.  Юзал бы и дальше, но вот спустя 4 месяца после установки,  начались проблемы с регулятором громкости. При добавлении громкости магнитола могла сама поднять на 3-5 делений и сразу же скинуть 5-6 ниже... Благо пульт в комплекте. Сдал в гарантию. При сдаче в гарантию меня заверили, что это разовый случай.  В остальном магнитолой я доволен.",4,positive
516,5160305,985,2815,2010-12-31,"Купил три месяца назад. Работает в паре с 208 + ещё наружный датчик. Показывает точно, а, главное, отлично видно с любого расстояния.",5,positive
406,4060501,879,1446,2013-01-14,"Пользуюсь два года. Соковыжималка нормальная. Как то пропало питание (тумблер не реагировал на нажатия), повёз в ремонт и при проверке она заработала. После этого прошёл год. Работает без нареканий. Вот такие чудеса!",4,positive
412,4120201,798,2947,2010-02-08,"Неумение обращаться с изделием не делает изделие плохим. Наверняка девушка в первый раз в жизни заправляла горизонтальный челнок. там есть небольшая хитрость, показанная наглядно в видеоролике на прилагаемом CD. Больше года использую такую ""в хвост и гриву"", профессионально - не нарадуюсь.",5,positive
304,3040104,1,1662,2010-08-16,Когда данный товар появится в наличий магазинов нашего города?,5,positive
413,4130901,66,2006,2016-06-09,"Я был вообще готов купить новую бритву, но воворемя узнал что можно купить просто сетку со сменным блоком, и вся проблема. В моем случае сетка и режущий блок представляют собой единую систему и не меняются по отдельности, поэтому в наборе они тоже идут вместе. Подходит для бритв Браун 7-ой серии.",5,positive
411,4110102,48,2217,2013-12-02,"Отличный пылесос, очень мощный, после одной уборки контейнер был полный, как будто и не пылесосили никогда. Чаша очень просто очищается, недорог  в эксплуатации, один раз в год нужно поменять фильтр, который стоит 400 руб. Берите, не пожалеете",5,positive
203,2030201,93,767,2010-06-28,"Купил это ноутбук 3 недели назад.Выбор делал из моделей АSUS,Аcеr,HP.Мне ноут был нужен для работы и чтобы фильмы посмотреть.В целом покупкой доволен.Есть все что нужно камера,блютус,факс.Оператива новейшая DDRЗ, 3 гига,довольно шустрая,Процессор мощный.Порадовало наличие 4 портов USB.Также есть гнездо HDMI. Отвод тепла сзади ноута,что тоже хорошо.Большой плюс-тишина работы бука.Минусы: небольшой винчестер(250 гб) ,буквы на клаве одного цвета.Но это все мелочи.Так что ноутбук отличный.Всем советую,берите не пожалеете. Соотношение цена качество-самое то.Брал за 24 тыс.",4,positive
405,4050205,980,2481,2013-10-02,"Уже года три пашет, так что вещь хорошая!!",5,positive
510,5100102,710,1656,2010-04-24,"Кажется что сушка - это вещь на которой можно и нужно сэкономить, ну что в ней может быть особенного??Но посмотрите на эту, в ней сразу несколько существенных отличий от всех более дешевых аналогов.Во-первых, на ногах она ""стоит ровно"", они не перекрещиваются.Во-вторых, имеет пластиковые защитные части и ножки имеют ступор в сторону раскладывания.В-третьих, в ножки вмонтированы колесики, и даже если на сушке до 20 кг белья ее можно легко переместить в помещении.В-четвертых, она оснащена замечательными отстегивающимися ""ушами"",которые можно  приспособить к батарее,если нужна интенсивная сушка или количество белья невелико.И, в-последних, клип, на который она закрывается, предотвращая разваливание во время хранения.Это просто мечта!!!",5,positive
515,5150101,11,690,2013-07-24,"Наушники просто великолепные! Качество звука - отличнейшее. Басы Otto Dix чувствовались великолепно! Но все же погибли, не прожив и трех месяцев. Сначала отломалось само ушко. Клеили - держалось. Потом переломилась стыковка (где два кабеля в один переходят), а затем уже и само основание. И, как все говорят, сами ушки разбалтываются, почти не держатся. Но наушники были просто отменные! Ни одни из своих я так не любила.",4,positive
303,3030501,1542,1414,2010-06-26,"вообще игра для тех, кто любит побродить.поискать.подумать.да сюжет нелинейный, в чем вся прелесть игры.завораживающий геймплей.игра классная, всем советую.купил соньку из-за нее и еще пару игр.нисколько не жалею потраченных денег))))))))))",5,positive
405,4050303,81,2680,2016-01-16,"У нас такая система установлена в офисе, помещение около 35 квадратов, рабочие места определены перегородками, т.е. все 11 человек дышат одним воздухом. Летом, конечно, мрак, в офисе душно, жарко, центральная вентиляция не справляется со своей задачей и при работе гудит жутко. Установки этого кондиционера оказалось достаточно, чтобы забыть о духоте и не мучиться от жары. Работает тихо. Я прихожу на работу первая и его включение моя ответственность. Минут 15 требуется, чтобы охладить все помещение, холодный воздух развеивает равномерно, направление дува установлено над уровнем стоящего человека, поэтому никто из сотрудников не жалуется на прямое его проветривание. На корпусе есть цветной дисплей, на котором отражаются установки. Данный кондиционер можно использовать для обогрева даже при небольшом минусе, по паспорту до -5. Если покупать домой, то думаю что его одного хватит на всю двухкомнатную квартиру.",5,positive
515,5150101,1453,2052,2009-08-26,"Отличнейшие наушники за такие деньги. Хорошо шумоизолируют,надежные и звук ровный, очень доволен покупкой. Пользуюсь более 7 месяцев.",5,positive
411,4110104,13,878,2011-01-27,"Маленький и удобный пылесос.После покупки лучше сразу купить комплект бумажных одноразовых мешков.Шумноват,но соседи не жалуются).  Из минусов: когда засасывает металлические предметы,то наэлектризовывается весь.Иногда бьет статическим током.  В целом,очень хороший аппарат.",5,positive
411,4110103,1050,2217,2017-07-14,"Очень легко моется , нет лишних деталей",4,positive
203,2030301,93,656,2009-10-02,"комп пуляет, просто самолет, даже не смотря на висту 32, долго сомневался из-за размеров, очень тихий, я доволен как слон, диагноз: брать!",5,positive
412,4120201,882,257,2013-11-18,"к сожалению присутствие лампочки мало обрадовало, стоит очень высоко и не выполняет своего прямого назначения, освещает свои внутренности ,быстро греется и очень воняет пластмассой",4,positive
408,4080301,863,794,2010-02-27,"плита компактная, удобная, один большой минус на верхней панели через 6 месяцев потрескалась эмаль, обратилась в ремонт, плиту заменили без проблем, что приятно, но и на новой плите опять трещины по эмали сильные пошли.",4,positive
406,4060801,86,2923,2017-01-22,Хорошее качество ,5,positive
406,4060201,879,1225,2015-12-25,"Взбивает все очень хорошо и не важно что вы в него бросите. Моя семья любит когда нет нифилей(маленьких кусочков), на пятой скорости делает пюре, но приходиться включать пару раз по две минуты. Работал на протяжении года в плотном режиме для семьи из 4 человек. потом начал протекать нож. Считаю что за такие деньги год работы это мало.",4,positive
411,4110102,48,2947,2010-11-12,"Пылесос отличный. Мощный-это раз. Не по-детски тянет. Самые мелкие предметы и пыль, снимает, не оставляя следа. даже жидкость насухо! Качественная сборка, и никаких нареканий к качеству - это два. И третье - это конечно чистый воздух. Действительно очень чистый. Особенно, если использовать угольный фильтр.",5,positive
406,4061001,11,682,2016-07-10,"Отличный чайник. Кипятит быстро, не сильно шумный, если со временем зашумел - нужно очистить от накипи и снова все в порядке. А про тех, у кого лопается стекло на крышке, скажу, что не нужно было наливать и кипятиь воду выше максимальной отметки 1,7 литра!!! Чайнику 4 года, всегда наливаем воду чуть меньше максимальной отметки и все в порядке, стекло крепкое , специально постучал сегодня по нему пальцем - как новое. Вообщем рекомендую!",5,positive
405,4050101,829,1262,2016-04-18,"пользовалась 2 лета,пока очень довольна.",5,positive
405,4050303,81,1538,2013-06-12,"Покупали год назад, прошлое лето отработал хорошо, без каких- либо сбоев. В это лето тоже включаем, все нормально перезимовал хорошо. Большое значение имеет качественная установка самого кондиционера, (квалифицированными специалистами) на этом не стоит экономить. И тогда у любого кондиционера будет полет нормальный. Берите с запасом по квадратуре комнаты. Мы такой взяли на комнату в 16 кв.м. + совмещенная кухня 6 кв. м.",5,positive
413,4130201,759,1538,2016-03-04,"Долго думала, какой набор выбрать. Остановилась на этом в виду сочетания цена-функциональность. Все насадки - нужные. Особенно нравится конусная, сферическая. Профессиональны пользуется сферической в салонах. Странно, что не во всех наборах она присутствует. Здесь есть. Порадовало, что есть пилочки, ими легко придавать форму ногтю, потом дорабатываю пилкой. Конечно, нужно уметь пользоваться, чтоб набор оказался полезным. Я делала в салоне аппаратный маникюр - поэтому было представление, каким образом пользоваться насадками. Маникюр получился как в салоне, кутикула растет медленнее, чем при обрезном маникюре. Особенно порадовала цена. Сейчас в магазине он не очень дорогой",5,positive
107,1070902,10,153,2011-01-22,"телевизор хороший, но вот такая проблема. что с флешки что с карты музыка с фотками воспроизводится а видео нет. пишет что ""нет файлов для воспроизведения"" я и форматировал всё, и видео кодировал ничего не помогает",4,positive
205,2050201,13,1538,2010-12-20,"Я купила телефон неделю назад. Впринцепе мне все нравится,но есть одно ""но"", редко, но бывает, когда разблокируешь его и нажимаешь на меню, экран становится красным, и меню так и не появляется...",5,positive
505,5050101,1031,763,2017-07-15,Удобная вещица))),4,positive
411,4110104,81,1952,2011-02-24,"Пользуюсь вторую неделю, выбирала между циклонным пылесосом и пылесосом с пылесборником,в итоге остановилась на этой модели и не ошиблась. Очень тихий, легкий пылесос. Убирать им одно удовольствие. Мощность тоже на высоте, удобно регулируется ручка, ну и конечно же длинный шнур.",5,positive
203,2030201,995,2051,2010-04-06,общее мнение таково Ноутбук Packard Bell DT85-CT-015RU про-во КНР все это знают когда покупали а сравнения с Acer-ом не много не каректная у меня был7520 грелся жуть карта8600 в конце концов видюха сгорела.а по клавеатуре поделюсь своим опытом A4TechX7G100 решает все боталии.Но минусы все перечисленные я потверждаю плюс заглючилHDD WD я от него этого не ожидал.видно сказывается КНР фактор.в общем покупка себя оправдывает так как кроме китая ничего не найти даже в америке.УДАЧНЫХ ПОКУПОК,5,positive
413,4130301,63,1869,2011-03-25,"Подарила мужу на день рождение машинку для стрижки волос. У нас она уже 6 месяцев, нареканий нет.   Только положительные эмоции! Стригу самой маленькой насадкой 3 мм: просто супер, волосы не дергает, убирает волосы с первого раза и не оставляет бороздок. Вибрация в пределах нормы, удобна в руке. Мыть ее не нужно, смазывать тоже, лишь чистить щеточкой и продувать от мелких волосков. Очень удобна и проста в применении. Муж доволен и я рада.   Пару раз стригла свекра-очень понравилось.Теперь собираемся ему на юбилей такую же подарить.",5,positive
