item_category,item_id,brand,user_id,date,comment,rating,tonality,translated_comment
303,3030501,1542,767,2010-10-28,"У кого уже есть EyePet (не Мув Эдишн), достаточно скачать обновление в PSN (весит около 2 Гб) для игры с Мувом. Запускать такой апдейт нужно через меню игр (там появится отдельная иконка), а не через диск.    А в целом EyePet Мув Эдишн играбельнее своей первой версии. Мув намного удобнее ""волшебной карточки"". Да и новых халявных игрушек добавили)",5,positive,"If you already have EyePet (not Move Edition), you only need to download the update from PSN (it weighs about 2 GB) to play with Move. You need to launch this update through the games menu (a separate icon will appear there), and not through the disk. But in general, EyePet Move Edition is more playable than its first version. Move is much more convenient than the &quot;magic card&quot;. And they added new free toys)"
103,1030105,767,767,2009-12-21,"Офигенный саб, стоит в ваз 2115, играет нормально, но хочу сейчас взять такой же",5,positive,"Awesome sub, it&#39;s in a VAZ 2115, plays fine, but now I want to get the same one"
413,4130801,66,2478,2017-01-29,"1) компактный 2) насадка для уменьшения площади эпиляции 3) подробная инструкция 4) 20 пинцетов, как и в более дорогих моделях",5,positive,"1) compact 2) attachment for reducing the area of epilation 3) detailed instructions 4) 20 tweezers, as in more expensive models"
413,4130801,66,1458,2016-09-06,"это мой первый эпиляторо и самый последний ни на что его не променяю. Пользуюсь уже им давно .   Волосы не пропускает и ни какой боли . В комплекте есть очень важная насадка для зоны бикини и подмышек . Конечно только один режим и то это не минус он в полне справляться со своими функциями .. Компактный , в руках держать ну очень удобно .",5,positive,"This is my first epilator and the last one, I will not exchange it for anything. I have been using it for a long time. It does not miss hair and does not cause any pain. The kit includes a very important attachment for the bikini area and armpits. Of course, only one mode and this is not a minus, it fully copes with its functions. Compact, very comfortable to hold in your hands."
406,4061101,76,2866,2010-09-12,"Недавно приобрели эту пароварку, пока что все нравиться)Единственное шумновато когда вода греется и вот мыть ее немного надоедает!  Но зато гурманы оценят, еда на пару просто шедевр, вкусно и очень полезно!",4,positive,"Recently bought this steamer, so far everything is fine) The only thing is that it is a bit noisy when the water is heating up and washing it is a bit annoying! But gourmets will appreciate it, steamed food is just a masterpiece, tasty and very healthy!"
205,2050101,1045,2459,2009-11-05,"Классный коммуникатор, лучший в своем роде. Есть все: 3g, wi-fi, большой экран с хорошим разрешением, удобное управление, красивое оформление, новый интерфейс, android market позволяет скачивать тысячи полезных программ бесплатно, в общем, качественно скомпонованный кпк.",5,positive,"Cool communicator, the best of its kind. It has everything: 3G, Wi-Fi, a large screen with good resolution, convenient control, beautiful design, new interface, android market allows you to download thousands of useful programs for free, in general, a high-quality PDA."
403,4030101,57,2923,2010-10-04,"Работает уже почти 2 года как часы! Ничего лишнего, все просто и понятно! Покупал по акции за 7000р. Всем доволен!",5,positive,"It has been working like clockwork for almost 2 years! Nothing extra, everything is simple and clear! I bought it on sale for 7000 rubles. I am happy with everything!"
515,5150101,11,843,2012-03-16,"Плюсы:  -хорошие глубокие басы;  -удобность при использовании(не жмут, сидят прекрасно и уши не потеют);  -чистый звук,высокие частоты хорошо слышно;  Минусы:  -тихий звук(в коментах выше тоже написано об этом,я читал на других форумах,говорят это возможно из-за того что шнур длинный)-думаю это главное разочарование.      А про шнур сказать нечего, пусть и длинный,но это это уже каждому решать нужен ли такой.",4,positive,"Pros: - good deep bass; - comfortable to use (do not press, sit perfectly and ears do not sweat); - clear sound, high frequencies are clearly audible; Cons: - quiet sound (in the comments above it is also written about this, I read on other forums, they say it is possible because the cord is long) - I think this is the main disappointment. And there is nothing to say about the cord, even though it is long, but it is up to each person to decide whether they need it."
205,2050101,455,656,2009-10-26,"Извиняюсь за дезинформацию. Батарею надо было ""закалить"". После второй зарядки держал 2 дня с редкими попытками посадить батарею. На сайте asusmobile написано до 6 циклов таких провернуть (с принудительной зарядкой длительностью 12 часов, и последующим саморазрядом)",5,positive,"Sorry for the misinformation. The battery needed to be &quot;hardened&quot;. After the second charge, it lasted 2 days with rare attempts to drain the battery. The asusmobile website says up to 6 such cycles can be done (with forced charging lasting 12 hours, and subsequent self-discharge)"
303,3030701,1542,3223,2010-11-19,"Достойное продолжение известной серии ,одиночка супер ,держит от начала до конца.Мультиплеер по мне лучше чем в Modern Warfare2 ,более сбалансированный.В целом игра супер.Всем поклонникам серии Call of Duty покупать обязательно!",5,positive,"A worthy continuation of the famous series, the single player is super, it keeps you going from start to finish. Multiplayer is better in my opinion than in Modern Warfare 2, more balanced. Overall, the game is super. All fans of the Call of Duty series should definitely buy it!"
118,1180102,1588,1811,2013-02-01,"Обалденный штатив. Снимаем в лесу, парке, везде, где есть возможность зацепить за какое-либо крепление. Держится прочно, все довольны.",5,positive,"Awesome tripod. We shoot in the forest, park, anywhere where there is an opportunity to hook it to some kind of mount. It holds firmly, everyone is happy."
203,2030201,995,605,2010-09-14,"Отличный ноутбук. Пользуюсь 2 месяца. Проблем нет. Мощный аппарат.  Из небольших минусов могу только выделить клавиатуру. Некоторые клавиши очень маленькие (а именно стрелки). Через некоторое время использования, клавиши проседают и их видно при сравнии уровней менее используемых. Ну угол обзора у экрана небольшой. Но это все мелкие минусы.    Кто не может найти дрова, заходите на сайты разработчиков комплектующих!!! Т.е. не нужно искать дрова на сайте паккард-белла и ацера! Там все старое и галимое. Заходите на сайты производителей: амд, интелл, реалтек.... и там все свежее качайте!",5,positive,"Excellent laptop. I&#39;ve been using it for 2 months. No problems. Powerful device. Of the small minuses, I can only highlight the keyboard. Some keys are very small (namely the arrows). After some time of use, the keys sag and they are visible when comparing the levels of less used ones. Well, the viewing angle of the screen is small. But these are all minor minuses. Who can&#39;t find drivers, go to the websites of the component developers!!! That is, you don&#39;t need to look for drivers on the Packard Bell and Acer website! Everything there is old and crappy. Go to the manufacturers&#39; websites: AMD, Intel, Realtek ... and download everything fresh there!"
406,4060501,62,2799,2012-04-16,"Согласна с Сашей и Наташей. Самая лучшая,самая удобная! Пользуюсь несколько лет и 2-ю на дачу купила такую же. Очень легко разбирается-собирается и моется!",5,positive,"I agree with Sasha and Natasha. The best, the most convenient! I&#39;ve been using it for several years and bought a second one for the dacha. It&#39;s very easy to disassemble, assemble and wash!"
403,4030101,57,1058,2016-04-08,"Тихая, узкая, недорогая. грузоподьёмная-5кг, что ещё надо для дома. Я доволен...",5,positive,"Quiet, narrow, inexpensive. Load capacity - 5 kg, what else do you need for home. I am satisfied..."
107,1070908,13,1347,2011-06-29,"Присоединяюсь к тому, что было написано ранее. Телевизор и в правду отличный. Смотреть фильмы в HD со встроенного медиаплеера самый кайф. Но при подключении PlayStation 3 сразу вылезли все недостатки плазменной технологии. Это статика, мерцание, отсутствие сглаживания и т.д. Сразу начали уставать глаза. Для игр - однозначно ЖК. Для фильмов - безусловно плазма.   Совет 1: Для того что-бы телевизор ночью сам не включался отключите функцию ""Обновление ПО в режиме ожидания"" пункт меню Поддержка-Обновление ПО.  Совет 2: При скачивании фильмов с торрентов следите за параметром High@L4.1 выше 4.1 телевизор читать не будет, проверенно)",4,positive,"I agree with what was written earlier. The TV is really great. Watching movies in HD with the built-in media player is the best experience. But when connecting the PlayStation 3, all the shortcomings of plasma technology immediately came to light. This is static, flickering, lack of anti-aliasing, etc. My eyes immediately began to get tired. For games - definitely LCD. For movies - definitely plasma. Tip 1: To prevent the TV from turning on by itself at night, disable the &quot;Software update in standby mode&quot; function (menu item Support - Software update). Tip 2: When downloading movies from torrents, watch the High@L4.1 parameter - the TV will not read anything higher than 4.1, I&#39;ve checked)"
405,4050104,617,690,2017-07-22,"Мощный,  тихий ",4,positive,"Powerful, quiet "
209,2090401,10,2562,2014-01-04,"Телефон нравится. Не дорогой, красивый, настройки не сложные.Качество звука очень хорошее.Покупкой полностью довольна!",5,positive,"I like the phone. It&#39;s not expensive, it&#39;s beautiful, the settings are not complicated. The sound quality is very good. I&#39;m completely satisfied with the purchase!"
410,4100101,48,1851,2012-03-05,"Подарила такую кофеварку мужу на 23 февраля. Несколько раз пили кофе, очень понравилось. Кофеварка хорошая, пока все нравится, датчик уровня воды есть, только он плохо видим, хотя, я думаю, что он и не нужен.                 Хорошая кофеварка и не дорогая.",5,positive,"I gave this coffee maker to my husband for February 23rd. We drank coffee several times, he really liked it. The coffee maker is good, so far everything is fine, there is a water level sensor, only it is hard to see, although I think it is not needed. A good coffee maker and not expensive."
401,4010101,55,1440,2011-11-21,"А я давно уже протираю эту панель  салфетками из микрофибры (сначала влажной, потом сухой) - тоже никаких разводов. Ну и, конечно, периодически со специальными средствами для нержавейки. У панели очень удобный электроподжиг - легкий, быстрый. Панель нагревается, но не сильно. По поводу отзыва от Анны: со всем согласна, а что касается невозможности поставить рядом две большие кастрюли - это верно, но у меня и на плите Indesit было так же. Кстати, нужно быть осторожными - царапается очень легко, но эти маленькие царапинки не особенно и видны.",5,positive,"I have been wiping this panel with microfiber cloths for a long time now (first wet, then dry) - no streaks either. And, of course, periodically with special products for stainless steel. The panel has a very convenient electric ignition - easy, fast. The panel heats up, but not much. Regarding Anna&#39;s review: I agree with everything, and as for the impossibility of putting two large pots next to each other - this is true, but I had the same problem on my Indesit stove. By the way, you need to be careful - it scratches very easily, but these small scratches are not particularly visible."
411,4110101,137,1453,2014-01-08,"Купил перед рождеством пылесос. Как только приехал домой, сразу опробовал. Скажу честно, ожидал большего. Руку подносишь к щетке, вроде засасывает, но не достаточно хорошо. Понимаю, что маленький и ожидать большего не стоит, но думал что будет лучше. Пыль и мусор сосет, но нужно очень много раз водить по одному и тому же месту. Складная щетка пригодна только для сидений, где меньше всего загрязнения. Потому что ею нужно водить только в одном направлении - к себе. Так как она складывается, когда ею ведешь от себя. Когда чистил пол несколько раз она складывалась, раздражает. Теперь о плюсах. Провод реально длинный. Чуть ли не всю машину обошел с пылесосом, не выключая шнур. Можно поставить пылесос на сиденье, а шлангом чистить пол и под сиденьями. Шланг очень мягкий и гибкий. Насадками пролезешь где угодно. Вывод: если не запускать салон авто до состояния помойки, данный пылесос справится с мелким мусором. Но идеально чисто он конечно не вычистит.",4,positive,"I bought a vacuum cleaner before Christmas. As soon as I got home, I tried it out. To be honest, I expected more. You put your hand to the brush, it seems to suck, but not well enough. I understand that it is small and you shouldn&#39;t expect more, but I thought it would be better. It sucks up dust and dirt, but you need to move it over the same place many times. The folding brush is only suitable for seats, where there is the least amount of dirt. Because you only need to move it in one direction - towards you. Because it folds when you move it away from you. When I was cleaning the floor, it folded several times, which was annoying. Now about the pros. The cord is really long. I walked almost the entire car with the vacuum cleaner without unplugging the cord. You can put the vacuum cleaner on the seat and clean the floor and under the seats with the hose. The hose is very soft and flexible. You can fit the attachments anywhere. Conclusion: if you don&#39;t let the car&#39;s interior get to the point of being a dump, this vacuum cleaner will cope with small debris. But it certainly won&#39;t clean it perfectly."
413,4130701,66,3150,2017-01-20,"До этой бритвы 3 года пользовался Braun 5 серии. Меня устраивала, хотя иногда и возникало раздражение, если переусердствовал. Я заметил, что в этой модели они уменьшили ячейку бритвенной сетки, что снизило воздействие на кожу -> реально меньше раздражение, точнее его вообще нет. Можно возить по морде сколько хочешь пока не будет идеально чисто. Нравится, что сетка и нож фиксированы (в предыдущих моделях они были отдельно) мне кажется, что это позволяет им идеально притираться, после некоторого использования стала получше брить. Думаю, что стакан лишний, особенно за такие деньги. Мою после каждого бритья под краном сетку и саму бритву. Если деньги есть, то берите эту эту, если хотите дешевле, то я думаю, что можно взять без пульсоника, но вот сетку+нож очень рекомендую такую как в этой модели.",5,positive,"Before this razor, I used the Braun 5 series for 3 years. I was happy with it, although sometimes it would irritate me if I overdid it. I noticed that in this model they made the mesh of the shaving grid smaller, which reduced the impact on the skin -&gt; there is really less irritation, or rather none at all. You can move it around your face as much as you want until it is perfectly clean. I like that the mesh and the blade are fixed (in previous models they were separate), it seems to me that this allows them to rub in perfectly, after some use it began to shave better. I think that the glass is unnecessary, especially for that kind of money. I wash the mesh and the razor itself under the tap after each shave. If you have the money, then take this one, if you want it cheaper, then I think you can take it without the pulseonic, but I highly recommend the mesh + blade like the one in this model."
403,4030101,48,970,2011-06-03,"Заказывали через интернет, привезли на этой неделе. Уже активно пользуемся, никаких нареканий, управлять ею просто, тихая (по сравнению с нашей бывшей, которой уже 20 лет было!!!), стирает хорошо, мы очень довольны покупкой.",5,positive,"We ordered it online, it was delivered this week. We are already actively using it, no complaints, it is easy to operate, quiet (compared to our previous one, which was already 20 years old!!!), it washes well, we are very happy with the purchase."
405,4050301,1000,2217,2011-07-04,"Отличный аппарат. Шумит меньше многих других моделей. В квартире это второй кондиционер, есть с чем сравнивать. Скоростей 3, а не одна, как писал Алексей. Комнату 20 м.кв. охлаждает быстро, порой даже приходится приоткрывать дверь из комнаты. Вода выводится по испарителю. После недели работы так и не пришлось сливать конденсат.",5,positive,"Excellent device. It makes less noise than many other models. This is the second air conditioner in the apartment, so there is something to compare it with. There are 3 speeds, not one, as Alexey wrote. It cools a 20 sq. m. room quickly, sometimes you even have to open the door from the room. Water is discharged through the evaporator. After a week of operation, I still haven&#39;t had to drain the condensate."
515,5150101,10,2923,2015-05-10,Лучшие наушники за свою цену!!,5,positive,The best headphones for their price!!
406,4061201,10,690,2012-04-04,"отличная вещь,когда купила неделю стояла, боялась начать готовить, сейчас подумываю о покупке второй-в одной суп, во второй десерт или второе, экономит все-время,нервы, продукты тоже-все приготовленное съедается на ура!",5,positive,"It&#39;s a great thing, when I bought it it stood there for a week, I was afraid to start cooking, now I&#39;m thinking about buying a second one - soup in one, dessert or a main course in the second, it saves everything - time, nerves, products too - everything cooked is eaten with a bang!"
203,2030201,1006,667,2010-02-10,"Пользуюсь буком 3 месяца, производительность ноута просто потрясающая, супер звук, отличный экран и непревзойденный дизайн, USB портов пока вполне хватает.  Из минусов - это конечно же абсолютно не адекватная всему остальному видеокарта и ее, к сожалению, никак не поменять, однако практически все современные игры (DragonAge, Oblivion, Risen, Call of Duty: ModernWarfire 2, NFS Shift (чуть тормозит, но играть можно)идут без проблем, чего не скажешь о GTA4.  Еще один минус - Windows Vista Home Basic, лучше бы тогда в microsoft не предлагали программу перехода на windows 7, т.к. после этого практически все ноуты идут с предустановленной vista Home Basic (не поддерживается вышеназванной программой).  Итог: в целом, если вы не геймер, ноут просто супер, всем кто любит стильные вещицы рекомендуется.",5,positive,"I have been using the laptop for 3 months, the performance of the laptop is simply amazing, super sound, excellent screen and unrivaled design, USB ports are still quite enough. Of the minuses - this is, of course, absolutely inadequate to everything else video card and, unfortunately, it can not be changed, but almost all modern games (DragonAge, Oblivion, Risen, Call of Duty: Modern Warfire 2, NFS Shift (a little slow, but you can play) go without problems, which can not be said about GTA4. Another minus - Windows Vista Home Basic, it would be better if Microsoft did not offer a program for switching to Windows 7, because after that almost all laptops come with pre-installed Vista Home Basic (not supported by the above program). Result: in general, if you are not a gamer, the laptop is just super, everyone who loves stylish things is recommended."
