item_category,item_id,brand,user_id,date,comment,rating,tonality,translated_comment
411,4110103,1050,2170,2017-05-18,Очень мощный. Чистит отлично.,5,positive,Very powerful. Cleans perfectly.
205,2050201,656,2923,2010-03-17,"Телефон очень классный, но для него очень мало тем и игр, особенно прошивок.",5,positive,"The phone is very cool, but there are very few themes and games for it, especially firmware."
413,4130701,10,1662,2010-08-21,"Бреюсь два года, имею жесткую щетину и раздражительную кожу.До этой бритвы бритьё казалось адом, Mach3-хватило лезвия на 2ва раза и то весь изрежешься и не пробреешься. Пробовал браун чуть получше лезвий, но раздражение. Панасоником бреюсь на сухую режущий блок пока не менял. Всем такую бритву советую.",5,positive,"I&#39;ve been shaving for two years, I have a hard stubble and irritated skin. Before this razor, shaving seemed like hell, Mach3 - the blade was enough for 2 times and then you&#39;ll get all cut up and not shave. I tried Braun, slightly better blades, but irritation. I shave with Panasonic dry, I haven&#39;t changed the cutting block yet. I recommend this razor to everyone."
103,1030105,829,2624,2010-03-30,"Я себе поставил этот комплект и не о чем не пожелел. Очень классный комплект Mystery, покупайте не пожелеете.",5,positive,"I installed this set for myself and did not regret anything. Very cool Mystery set, buy it, you will not regret it."
205,2050201,13,3106,2010-07-02,"купила недавно и очень рада!  превосходный телефон с прикольными сменными панелями.  яркий,модный,красивый,понятный и удобный. и т.д  неплохая камера не хуже чем у star:)  мало недостатков, хорошего в нём намного больше!  с каждым днём радует всё больше!  много доступа к интернету!  может заменить плеер)  ооочень хороший телефон!)  советую всем брать!и цена хорошая...)",5,positive,"I bought it recently and I am very happy! An excellent phone with cool interchangeable panels. Bright, fashionable, beautiful, clear and convenient. etc. A good camera, not worse than the star :) Few disadvantages, much more good in it! Every day I am more and more happy! Lots of internet access! Can replace the player) A very good phone!) I advise everyone to take it! And the price is good...)"
412,4120101,76,1440,2011-03-22,"Очень хороший!!!!!!!!!! была приятно удивлена тем, как легко и просто он гладит, точнее как разглаживает складки! сейчас у меня пора пеленок и хороший утюг сильно экономит время! я и раньше любила гладить белье, а теперь это просто наслаждение. надеюсь он прослужит долго!!!",5,positive,"Very good!!!!!!!!!! I was pleasantly surprised by how easy and simple it is to iron, or rather how it smooths out creases! Now it&#39;s diaper time for me and a good iron saves a lot of time! I used to love ironing clothes, and now it&#39;s just a pleasure. I hope it will last a long time!!!"
404,4040203,755,181,2010-01-28,"Куплен зимой для создания нормальной влажности в комнате. С задачей справляется на 100  на маленькой скорости, так как, чтоб ни говорили стоит гул на высокой, да она и не нужна для комнаты в 22 кв.м. Пыли стало гораздо меньше. Влажность 55 %. Сменный фильтр найти не проблема, стоит только достаточно дорого от 700р, в инете полно предложений. советую покупать.",4,positive,"Bought in winter to create normal humidity in the room. It copes with the task 100% at low speed, because, no matter what they say, there is a hum at high speed, and it is not needed for a room of 22 sq.m. There is much less dust. Humidity is 55%. It is not a problem to find a replacement filter, it is just quite expensive from 700 rubles, there are plenty of offers on the Internet. I advise you to buy it."
406,4061001,617,1217,2016-01-27,"Чайник с виду не плохой, чуток не понравилось, что крышка у него не много хлябает, ну это и понятно цена для качества не велика. Красивая синяя подсветка очень радует глаз, при первом кипячении пахло не понятно чем, хотя воду наливали через фильтр, думаю, что позже запах выветрится.ставлю 5 баллов только из за цены.",5,positive,"The kettle looks good, I didn&#39;t like that the lid sloshes a little, well, that&#39;s understandable, the price is not high for the quality. The beautiful blue backlight is very pleasing to the eye, when it boiled for the first time it smelled of something unknown, although the water was poured through a filter, I think that the smell will disappear later. I give it 5 points only because of the price."
103,1030304,795,2957,2009-09-28,"В общем аппарат хороший, настроек не очень много, но и не мало. Качество изображения, для экрана такого размера, на 5.  Качество звучания на 4.  Юзал бы и дальше, но вот спустя 4 месяца после установки,  начались проблемы с регулятором громкости. При добавлении громкости магнитола могла сама поднять на 3-5 делений и сразу же скинуть 5-6 ниже... Благо пульт в комплекте. Сдал в гарантию. При сдаче в гарантию меня заверили, что это разовый случай.  В остальном магнитолой я доволен.",4,positive,"Overall, the device is good, there are not many settings, but not few either. The image quality, for a screen of this size, is 5. The sound quality is 4. I would have continued using it, but 4 months after installation, problems with the volume control began. When increasing the volume, the radio could itself increase by 3-5 divisions and immediately drop 5-6 below... Fortunately, the remote control is included. I returned it for warranty. When I returned it for warranty, I was assured that this was a one-time incident. Otherwise, I am happy with the radio."
516,5160305,985,2815,2010-12-31,"Купил три месяца назад. Работает в паре с 208 + ещё наружный датчик. Показывает точно, а, главное, отлично видно с любого расстояния.",5,positive,"I bought it three months ago. It works in tandem with 208 + an external sensor. It shows accurately, and, most importantly, it is perfectly visible from any distance."
406,4060501,879,1446,2013-01-14,"Пользуюсь два года. Соковыжималка нормальная. Как то пропало питание (тумблер не реагировал на нажатия), повёз в ремонт и при проверке она заработала. После этого прошёл год. Работает без нареканий. Вот такие чудеса!",4,positive,"I&#39;ve been using it for two years. The juicer is normal. Once the power went out (the switch didn&#39;t respond to pressing), I took it to be repaired and when I checked it, it started working. A year has passed since then. It works without any complaints. Such miracles!"
412,4120201,798,2947,2010-02-08,"Неумение обращаться с изделием не делает изделие плохим. Наверняка девушка в первый раз в жизни заправляла горизонтальный челнок. там есть небольшая хитрость, показанная наглядно в видеоролике на прилагаемом CD. Больше года использую такую ""в хвост и гриву"", профессионально - не нарадуюсь.",5,positive,"Inability to handle the product does not make the product bad. Surely the girl was threading a horizontal shuttle for the first time in her life. There is a small trick, clearly shown in the video on the attached CD. I have been using this one &quot;to the fullest&quot; for over a year, professionally - I am delighted."
304,3040104,1,1662,2010-08-16,Когда данный товар появится в наличий магазинов нашего города?,5,positive,When will this product be available in stores in our city?
413,4130901,66,2006,2016-06-09,"Я был вообще готов купить новую бритву, но воворемя узнал что можно купить просто сетку со сменным блоком, и вся проблема. В моем случае сетка и режущий блок представляют собой единую систему и не меняются по отдельности, поэтому в наборе они тоже идут вместе. Подходит для бритв Браун 7-ой серии.",5,positive,"I was ready to buy a new razor, but I found out in time that you can just buy a grid with a replaceable block, and that&#39;s the whole problem. In my case, the grid and the cutting block are a single system and are not changed separately, so they also come together in the set. Suitable for Braun razors of the 7th series."
411,4110102,48,2217,2013-12-02,"Отличный пылесос, очень мощный, после одной уборки контейнер был полный, как будто и не пылесосили никогда. Чаша очень просто очищается, недорог  в эксплуатации, один раз в год нужно поменять фильтр, который стоит 400 руб. Берите, не пожалеете",5,positive,"Excellent vacuum cleaner, very powerful, after one cleaning the container was full, as if it had never been vacuumed. The bowl is very easy to clean, inexpensive to operate, once a year you need to change the filter, which costs 400 rubles. Buy it, you will not regret it"
203,2030201,93,767,2010-06-28,"Купил это ноутбук 3 недели назад.Выбор делал из моделей АSUS,Аcеr,HP.Мне ноут был нужен для работы и чтобы фильмы посмотреть.В целом покупкой доволен.Есть все что нужно камера,блютус,факс.Оператива новейшая DDRЗ, 3 гига,довольно шустрая,Процессор мощный.Порадовало наличие 4 портов USB.Также есть гнездо HDMI. Отвод тепла сзади ноута,что тоже хорошо.Большой плюс-тишина работы бука.Минусы: небольшой винчестер(250 гб) ,буквы на клаве одного цвета.Но это все мелочи.Так что ноутбук отличный.Всем советую,берите не пожалеете. Соотношение цена качество-самое то.Брал за 24 тыс.",4,positive,"I bought this laptop 3 weeks ago. I chose from models ASUS, Acer, HP. I needed the laptop for work and to watch movies. Overall, I&#39;m happy with the purchase. It has everything you need: camera, Bluetooth, fax. The latest DDR3 RAM, 3 gigs, pretty fast, the processor is powerful. I was pleased with the presence of 4 USB ports. There is also an HDMI jack. Heat dissipation at the back of the laptop, which is also good. A big plus is the quiet operation of the laptop. Cons: small hard drive (250 GB), the letters on the keyboard are the same color. But these are all trifles. So the laptop is excellent. I advise everyone, take it, you will not regret it. The price-quality ratio is just right. I bought it for 24 thousand."
405,4050205,980,2481,2013-10-02,"Уже года три пашет, так что вещь хорошая!!",5,positive,"It&#39;s been working for three years already, so it&#39;s a good thing!!"
510,5100102,710,1656,2010-04-24,"Кажется что сушка - это вещь на которой можно и нужно сэкономить, ну что в ней может быть особенного??Но посмотрите на эту, в ней сразу несколько существенных отличий от всех более дешевых аналогов.Во-первых, на ногах она ""стоит ровно"", они не перекрещиваются.Во-вторых, имеет пластиковые защитные части и ножки имеют ступор в сторону раскладывания.В-третьих, в ножки вмонтированы колесики, и даже если на сушке до 20 кг белья ее можно легко переместить в помещении.В-четвертых, она оснащена замечательными отстегивающимися ""ушами"",которые можно  приспособить к батарее,если нужна интенсивная сушка или количество белья невелико.И, в-последних, клип, на который она закрывается, предотвращая разваливание во время хранения.Это просто мечта!!!",5,positive,"It seems that a dryer is something you can and should save on, well, what could be special about it? But look at this one, it has several significant differences from all cheaper analogues. Firstly, it &quot;stands straight&quot; on its legs, they do not cross. Secondly, it has plastic protective parts and the legs have a stop in the direction of unfolding. Thirdly, wheels are built into the legs, and even if it dries up to 20 kg of laundry, it can be easily moved around the room. Fourthly, it is equipped with wonderful detachable &quot;ears&quot; that can be adapted to the battery if intensive drying is needed or the amount of laundry is small. And, finally, a clip on which it closes, preventing it from falling apart during storage. It&#39;s just a dream!!!"
515,5150101,11,690,2013-07-24,"Наушники просто великолепные! Качество звука - отличнейшее. Басы Otto Dix чувствовались великолепно! Но все же погибли, не прожив и трех месяцев. Сначала отломалось само ушко. Клеили - держалось. Потом переломилась стыковка (где два кабеля в один переходят), а затем уже и само основание. И, как все говорят, сами ушки разбалтываются, почти не держатся. Но наушники были просто отменные! Ни одни из своих я так не любила.",4,positive,"The headphones are simply magnificent! The sound quality is excellent. The Otto Dix bass was felt magnificently! But they died, not having lived even three months. First, the ear itself broke off. We glued it - it held. Then the joint (where two cables turn into one) broke, and then the base itself. And, as everyone says, the ears themselves are loose, they almost do not hold. But the headphones were simply excellent! I have never loved any of mine so much."
303,3030501,1542,1414,2010-06-26,"вообще игра для тех, кто любит побродить.поискать.подумать.да сюжет нелинейный, в чем вся прелесть игры.завораживающий геймплей.игра классная, всем советую.купил соньку из-за нее и еще пару игр.нисколько не жалею потраченных денег))))))))))",5,positive,"in general, the game is for those who like to wander. search. think. yes, the plot is non-linear, which is the whole charm of the game. fascinating gameplay. the game is cool, I recommend it to everyone. I bought a sony because of it and a couple of other games. I do not regret the money spent at all))))))))))"
405,4050303,81,2680,2016-01-16,"У нас такая система установлена в офисе, помещение около 35 квадратов, рабочие места определены перегородками, т.е. все 11 человек дышат одним воздухом. Летом, конечно, мрак, в офисе душно, жарко, центральная вентиляция не справляется со своей задачей и при работе гудит жутко. Установки этого кондиционера оказалось достаточно, чтобы забыть о духоте и не мучиться от жары. Работает тихо. Я прихожу на работу первая и его включение моя ответственность. Минут 15 требуется, чтобы охладить все помещение, холодный воздух развеивает равномерно, направление дува установлено над уровнем стоящего человека, поэтому никто из сотрудников не жалуется на прямое его проветривание. На корпусе есть цветной дисплей, на котором отражаются установки. Данный кондиционер можно использовать для обогрева даже при небольшом минусе, по паспорту до -5. Если покупать домой, то думаю что его одного хватит на всю двухкомнатную квартиру.",5,positive,"We have such a system installed in the office, the room is about 35 square meters, the workplaces are defined by partitions, i.e. all 11 people breathe the same air. In the summer, of course, it is dark, the office is stuffy, hot, the central ventilation does not cope with its task and hums terribly when working. The installation of this air conditioner was enough to forget about the stuffiness and not suffer from the heat. It works quietly. I come to work first and its activation is my responsibility. It takes about 15 minutes to cool the entire room, the cold air disperses evenly, the blowing direction is set above the level of a standing person, so none of the employees complain about direct ventilation. There is a color display on the body, which reflects the settings. This air conditioner can be used for heating even at a slight minus, according to the passport up to -5. If you buy it for home, I think that one of it will be enough for the entire two-room apartment."
515,5150101,1453,2052,2009-08-26,"Отличнейшие наушники за такие деньги. Хорошо шумоизолируют,надежные и звук ровный, очень доволен покупкой. Пользуюсь более 7 месяцев.",5,positive,"Excellent headphones for the money. They isolate noise well, are reliable and the sound is even, I am very happy with the purchase. I have been using them for more than 7 months."
411,4110104,13,878,2011-01-27,"Маленький и удобный пылесос.После покупки лучше сразу купить комплект бумажных одноразовых мешков.Шумноват,но соседи не жалуются).  Из минусов: когда засасывает металлические предметы,то наэлектризовывается весь.Иногда бьет статическим током.  В целом,очень хороший аппарат.",5,positive,"A small and convenient vacuum cleaner. After purchasing it, it is better to immediately buy a set of paper disposable bags. It is noisy, but the neighbors do not complain). Of the minuses: when it sucks in metal objects, it becomes electrified all over. Sometimes it shocks with static electricity. In general, a very good device."
411,4110103,1050,2217,2017-07-14,"Очень легко моется , нет лишних деталей",4,positive,"Very easy to clean, no unnecessary parts"
203,2030301,93,656,2009-10-02,"комп пуляет, просто самолет, даже не смотря на висту 32, долго сомневался из-за размеров, очень тихий, я доволен как слон, диагноз: брать!",5,positive,"the computer shoots, just a plane, even despite Vista 32, I doubted for a long time because of the size, very quiet, I&#39;m happy as an elephant, diagnosis: buy it!"
412,4120201,882,257,2013-11-18,"к сожалению присутствие лампочки мало обрадовало, стоит очень высоко и не выполняет своего прямого назначения, освещает свои внутренности ,быстро греется и очень воняет пластмассой",4,positive,"Unfortunately, the presence of a light bulb was of little use, it stands very high and does not fulfill its intended purpose, it illuminates its insides, heats up quickly and smells very much of plastic"
408,4080301,863,794,2010-02-27,"плита компактная, удобная, один большой минус на верхней панели через 6 месяцев потрескалась эмаль, обратилась в ремонт, плиту заменили без проблем, что приятно, но и на новой плите опять трещины по эмали сильные пошли.",4,positive,"the stove is compact, convenient, one big minus on the top panel after 6 months the enamel cracked, I went to repair, the stove was replaced without any problems, which is nice, but even on the new stove there are strong cracks in the enamel again."
406,4060801,86,2923,2017-01-22,Хорошее качество ,5,positive,Good quality 
406,4060201,879,1225,2015-12-25,"Взбивает все очень хорошо и не важно что вы в него бросите. Моя семья любит когда нет нифилей(маленьких кусочков), на пятой скорости делает пюре, но приходиться включать пару раз по две минуты. Работал на протяжении года в плотном режиме для семьи из 4 человек. потом начал протекать нож. Считаю что за такие деньги год работы это мало.",4,positive,"It whips everything very well and it doesn&#39;t matter what you throw in it. My family likes it when there are no nifles (small pieces), at the fifth speed it makes puree, but you have to turn it on a couple of times for two minutes. It worked for a year in a tight mode for a family of 4. Then the knife started leaking. I think that for that kind of money a year of work is not enough."
411,4110102,48,2947,2010-11-12,"Пылесос отличный. Мощный-это раз. Не по-детски тянет. Самые мелкие предметы и пыль, снимает, не оставляя следа. даже жидкость насухо! Качественная сборка, и никаких нареканий к качеству - это два. И третье - это конечно чистый воздух. Действительно очень чистый. Особенно, если использовать угольный фильтр.",5,positive,"The vacuum cleaner is excellent. Powerful - that&#39;s one. Pulls like a child. The smallest objects and dust, removes, leaving no trace. Even liquid dry! High-quality assembly, and no complaints about the quality - that&#39;s two. And third - of course, it&#39;s clean air. Really very clean. Especially if you use a carbon filter."
