item_category,item_id,brand,user_id,date,comment,rating,tonality,translated_comment
403,4030101,49,573,2010-02-04,"Стираем на ней ,уже больше года с учетом стирки детских вещей. Никаких проблем не было, стирает хорошо, есть удобный режим быстрой стирки, довольно тихая, словом, нам нравится ))",5,positive,"We have been washing on it for over a year now, taking into account washing children&#39;s clothes. There were no problems, it washes well, there is a convenient quick wash mode, it is quite quiet, in a word, we like it))"
412,4120101,759,551,2011-02-16,"Действительно, при заливании кипячёной воды, утюг в дальнейшем начнёт гладить с накипью. Всегда мучились с очисткой этого утюга. Насчёт того, что протекает вода, так не нужно заливать воды больше отметки МАХ. У нас этот утюг проработал 2 года и просто перестал нагреваться.",4,positive,"Indeed, when pouring boiled water, the iron will start ironing with scale. We always had trouble cleaning this iron. As for the water leaking, you don&#39;t need to pour more water than the MAX mark. This iron worked for us for 2 years and simply stopped heating up."
207,2070202,668,656,2010-02-08,"Прикольный плеер. Качево звука хорошее! Видео еще лучше, если правильно кодировать!Конвертируйте видео в размер 320*240 через XvID в avi!  За эти деньги хорошая вещь! Все предельно просто!",5,positive,"Cool player. Good sound quality! Video is even better if you encode it correctly! Convert video to 320*240 via XvID to avi! For this money, it&#39;s a good thing! Everything is extremely simple!"
107,1070904,13,656,2010-06-04,"Аппарат хороший(по соотношению цена/качество). Он у меня второй после плазмы от Panasoniс 50'.   Эфир со спутника транслирует, хорошо, чуть уступая  вышеуказанной плазма, но лучше растягивает изображение формата 4:3. Отыгрывается в полный рост перед плазмой, при воспроизведении HD видео,сигнала с компьютера в разрешении 1920*1080 и другого видеосигнала с высоким битрейтом (спорить о преимуществах плазмы и ЖК не буду). Экран не бликует, а для моей комнаты это важно. Плазму(она у меня без антибликового покрытия) там солнечным днём смотреть не могу. Меню удобное с кучей настроек, простое. Имеет неплохой звук, для встроенных динамиков.Разнообразных входов/выходов достаточно. Мне, лично, хватает сполна для подключения одновременно всей имеющейся у меня аппаратуры. Из минусов могу отметить лишь легко царапающийся пластик, и то,что к нему сильно липнет пыль.",5,positive,"The device is good (in terms of price/quality ratio). It is my second after the Panasonic 50&#39; plasma. It broadcasts satellite broadcasts well, slightly inferior to the above-mentioned plasma, but stretches the image in 4:3 format better. It plays in full growth in front of the plasma, when playing HD video, a signal from a computer in the resolution of 1920 * 1080 and other video signals with a high bitrate (I will not argue about the advantages of plasma and LCD). The screen does not glare, and this is important for my room. I can not watch plasma (I have it without an anti-glare coating) there on a sunny day. The menu is convenient with a bunch of settings, simple. It has good sound for built-in speakers. There are enough different inputs / outputs. Personally, for me, it is more than enough to connect all the equipment I have at the same time. Of the minuses, I can only note the easily scratched plastic, and the fact that dust sticks to it."
403,4030101,57,968,2017-07-23,"Цена, простота, узкота.",5,positive,"Price, simplicity, narrowness."
203,2030301,93,2006,2010-06-03,"Компьютер хорош!  Процессор летает, а не работает!  В общем всё отлично, не считая небольшого дребезжания после включения компьютера",5,positive,"The computer is good! The processor flies, but does not work! In general, everything is great, except for a small rattle after turning on the computer"
403,4030101,1425,1569,2011-06-15,"Машинка супер.  Управление: интуитивно понятное, инструкция нужна только чтобы узнать куда порошок засыпать и зачем дополнительная кювета.  Шум: супер тихая. Можно шёпотом разговаривать :)  Надёжность: пока не знаю.    Рекомендую.",5,positive,"The machine is super. Control: intuitive, the instructions are only needed to find out where to pour the powder and why the additional tray is needed. Noise: super quiet. You can talk in a whisper :) Reliability: I don&#39;t know yet. I recommend it."
203,2030301,692,656,2010-08-23,"Купил в Марте пользуюсь...и очень даже нравится,правда Windows 7 домашняя базовая стояла,но я ее поменял на 7 Ultimate,а так все хорошо,пока не жалуюсь)))",5,positive,"I bought it in March, I&#39;m using it... and I really like it, although I had Windows 7 Home Basic, but I changed it to 7 Ultimate, but everything is fine, so far I have no complaints)))"
408,4080301,48,2815,2015-05-01,"Третий день в эксплуатации, в целом неплохо.  Один серьезный недостаток имеется все таки. Тупая инструкция. Куча ненужной информации, зато действительно необходимое проигнорировано. Режим быстрого нагрева, не указано время. Смысл тогда в нем, если нагревать можно и в других режимах. Отсутствие временных интервалов, очень серьезная оплошность",5,positive,"Third day of operation, not bad overall. There is one serious drawback though. Dumb instructions. Lots of unnecessary information, but what is really necessary is ignored. Fast heating mode, time is not specified. What&#39;s the point then, if you can heat in other modes. No time intervals, a very serious oversight"
404,4040105,617,1432,2009-10-05,"За свои денежки отличный товар, купил на распродаже, проветрил пару часов, и пользуюсь с удовольствием",5,positive,"For the money, this is a great product, I bought it on sale, aired it out for a couple of hours, and I use it with pleasure"
403,4030101,49,1046,2010-03-30,Отличная машина я рад этой покупке,5,positive,"Great car, I&#39;m happy with this purchase."
406,4061102,64,1861,2010-03-24,"Купили аппарат в январе, это реально мини-духовой шкаф!!!!! Есть все - конвекция, гриль, также часто пользуемся разморозкой, мясо и рыба, получается сочными! Очень  пригодился таймер и функция подогрева... Единственный минус - это все же - размер, занимает не мало места, хотя если сравнить сколько места занимает обычная плита (в т.ч. духовой шкаф) - это цветочки.....",5,positive,"We bought the device in January, it&#39;s a real mini-oven!!!!! It has everything - convection, grill, we also often use defrosting, meat and fish turn out juicy! The timer and heating function were very useful... The only downside is still the size, it takes up a lot of space, although if you compare how much space a regular stove (including an oven) takes up - it&#39;s nothing....."
403,4030101,57,2951,2011-07-14,Купила машину Indesit wisn 100 два года назад. До сих пор отлично работает. Правда очень сильно шумит во время отжима. Но учитывая что это Российское производство. Так что шум браком не считаю. У знакомых такая же и тоже сильно шумит.,4,positive,"I bought an Indesit wisn 100 two years ago. It still works great. It does make a lot of noise during spinning, though. But considering that it&#39;s Russian-made, I don&#39;t think the noise is a defect. My friends have the same one and it also makes a lot of noise."
411,4110102,81,1225,2010-01-25,"Первые впечатления - всё просто супер! Работает негромко, а тянет хорошо даже на малом режиме.",5,positive,"First impressions - everything is just super! It works quietly, and pulls well even at low speed."
404,4040203,725,257,2014-10-02,"Увлажнитель отличный. Но проработал 3 года. При аккуратном использовании, своевременной очистке и смене картриджа ежегодно, стоимость которого 800 рублей. Ремонт дорогой, закончился срок службы мембраны, по словам сервисного центра, частая причина.",5,positive,"The humidifier is excellent. But it worked for 3 years. With careful use, timely cleaning and changing the cartridge annually, which costs 800 rubles. Repair is expensive, the membrane has expired, according to the service center, a common reason."
413,4130401,11,1869,2013-07-30,"Понравился. Волосы не пересушивает, мощность достаточная. Укладку им делаю без каких-либо проблем. У моей родственницы такой же, она собственно им тоже вполне довольна.",5,positive,"I liked it. It doesn&#39;t dry out my hair, it&#39;s powerful enough. I can style my hair with it without any problems. My relative has the same one, and she&#39;s actually quite happy with it too."
404,4040104,64,2539,2013-12-18,"Сборка не КНР, а Россия.",5,positive,"Assembled in Russia, not China."
401,4010201,709,2489,2016-01-03,"Красота! Скоро год, как мы ее купили и вытяжка только радует своей производительностью)) Ее очень просто использовать, в управлении отсутствуют всякие ненужные навороты, все предельно ясно и даже без мануала можно понять принцип ее работы. Хорошо вписывается в любой интерьер, в нашем случае покупалась под деревянную кухню и выглядит в ансамбле с ней очень красиво))) Заметила, что реже стала протирать кафельные стены вокруг рабочей поверхности плиты - жир просто улетучивается после приготовления еды, кроме этого запахи тоже убирает на ура, особенно после жарки рыбы или мяса. Шум на первой скорости не беспокоит, но двойка и тройка уже громче работают, впрочем, звук вполне терпимый. Из недостатков только отпечатки пальцев на самой поверхности вытяжки беспокоят, но кроме этого все отлично))",5,positive,"Beauty! It&#39;s been almost a year since we bought it and the hood only pleases with its performance)) It is very easy to use, there are no unnecessary bells and whistles in the controls, everything is extremely clear and even without a manual you can understand the principle of its operation. It fits well into any interior, in our case it was bought for a wooden kitchen and looks very beautiful in combination with it))) I noticed that I began to wipe the tiled walls around the working surface of the stove less often - the fat simply evaporates after cooking, in addition, it also removes odors with a bang, especially after frying fish or meat. The noise at the first speed does not bother me, but the two and three are already louder, however, the sound is quite bearable. Of the shortcomings, only fingerprints on the surface of the hood bother me, but other than that, everything is great))"
412,4120101,617,1869,2012-12-21,"Утюг хороший за такую цену. Пересушенные вещи без отпаривания не отутюжить, а так утюжит и отпаривает хорошо. Пластмассой не пахнет, но воду в нем оставлять после окончания работы не стоит, она вытекает.",4,positive,"The iron is good for the price. You can&#39;t iron overdried clothes without steaming, but it irons and steams well. It doesn&#39;t smell like plastic, but you shouldn&#39;t leave water in it after you finish working, it leaks out."
411,4110104,11,3172,2012-04-15,"Купили пылесос неделю назад!  Огромное спасибо продавцам - консультантам в \""М-Видео\""!  Теперь о пылесосе - отличная вещь! Пыль собирает на УРА!В доме маленький ребенок и животное, обожающее линять - то есть кошка, с предыдущим пылесосом такой чистоты не было, всю кошачью шерсть с ковров убрал. А турбо щетка это отдельная песня - ковры с длинным ворсом - ворс приподнимает и всю грязюку собирает. Таких чистых и если можно так сказать расчесанных ковров я не припомню. Про чистку турбо щетки - это не трудно - даже волосы длинные, вы же расческу простите за собой чистите! Про удары статического электричества - в инструкции об этом написано! И товарищи курс физики в школе вспомните и все вопросы отпадут - при такой мощности. Да конечно можно было бы и изоляцию где-то сделать или пылесосить только за пластиковую часть, но на полной мощности таки накапливает это электричество - я думаю у производителей все впереди. Попробовали пройтись на полной мощности по линолеуму - во время остановились - приподнимает!Конечно на вкус и цвет сойтись с кем либо сложно, а вот от меня пылесосу - спасибо!",5,positive,"We bought a vacuum cleaner a week ago! Many thanks to the sales consultants at M-Video! Now about the vacuum cleaner - it&#39;s a great thing! It collects dust like a charm! There is a small child and an animal that loves to shed - that is, a cat - in the house, such cleanliness was not possible with the previous vacuum cleaner, it removed all the cat hair from the carpets. And the turbo brush is a separate song - carpets with long pile - it lifts the pile and collects all the dirt. I can&#39;t remember such clean and, if I may say so, combed carpets. About cleaning the turbo brush - it is not difficult - even long hair, you, forgive me, clean up after yourself with a comb! About static electricity shocks - it is written about this in the instructions! And comrades, remember the physics course at school and all questions will disappear - with such power. Yes, of course, it would be possible to make insulation somewhere or vacuum only by the plastic part, but at full power it still accumulates this electricity - I think the manufacturers have everything ahead. We tried to walk at full power on linoleum - we stopped in time - it lifts! Of course, it is difficult to agree on tastes and colors, but from me, the vacuum cleaner - thanks!"
406,4061001,617,1988,2011-07-26,"Чайник в принципе не плохой, отработал 2 года, на данный момент сгорела помпа, замены нет. Собираюсь купить новый.",4,positive,"The kettle is not bad in principle, it worked for 2 years, at the moment the pump burned out, there is no replacement. I am going to buy a new one."
219,3050101,1542,968,2010-09-30,"Раньше начиная с 06 ФИФА на компе ПЕС действительно рулил, а в этом году, с переходом ФИФА11 на некст-ген, ПЕС suck hard...    Так что игру однозначно нужно покупать лицензию, чтобы полностью насладится всеми режимами, а главное мультиплеером.",5,positive,"Previously, starting with FIFA 06 on the computer, PES really ruled, but this year, with the transition of FIFA11 to next-gen, PES suck hard... So you definitely need to buy a license for the game to fully enjoy all the modes, and most importantly, multiplayer."
203,2030201,995,767,2010-03-11,"Согласен с Рафом. Видимо тоже поторопился с dv6-2019er. Кто колеблется, покупать или нет этот ноутбук - берите не раздумывая.",5,positive,I agree with Raf. Apparently I was in a hurry with the dv6-2019er too. If you are hesitating whether to buy this laptop or not - take it without thinking.
407,4070301,120,3224,2010-04-21,"Доброго времени суток! Мне эта микроволновка прослужила 1,5 года, затем вышел из строя блок управления - точнее шлейф наборного поля, вот сейчас пытаюсь найти на митинском радио-рынке.",4,positive,"Good day! This microwave served me for 1.5 years, then the control unit failed - more precisely the ribbon cable of the dial field, now I&#39;m trying to find it at the Mitino radio market."
407,4070101,15,1538,2011-07-13,"Приобрели эту печку уже давно. Очень простое и доступное меню, достаточно мощная. Никаких недостатков при использовании не обнаружили. Всем советуем!",5,positive,"We bought this stove a long time ago. Very simple and accessible menu, quite powerful. We did not find any disadvantages when using it. We recommend it to everyone!"
406,4060801,62,2217,2010-09-08,"Купите не пожалеете!!! Хлеб отличный, тесто ставила подходит быстро.",5,positive,"Buy it, you won&#39;t regret it!!! The bread is excellent, the dough rises quickly."
207,2070202,925,567,2011-06-23,в этом плеере есть блокировка клавиатуры.  Плеер хороший!:)уже год пользуюсь...,5,positive,This player has a keyboard lock. The player is good!:) I&#39;ve been using it for a year now...
406,4061101,76,1026,2012-10-09,"Отличная вещь, печем и блины и оладьи из кабачков, даже яичницу жарил, очень удобно, отличное и вкусное развлечение для всей семьи!",5,positive,"Great thing, we bake pancakes and fritters from zucchini, even fried eggs, very convenient, excellent and tasty entertainment for the whole family!"
205,2050201,11,978,2010-01-25,"Телефон в принципе норм, громкие динамики, мощный аккумулятор, но зато на отдельных абонентов и даже на группы не поставить индивидуальных звонков, так же в магазине говорили, что в комплекте идёт флешка, нет",4,positive,"The phone is basically normal, loud speakers, powerful battery, but you can&#39;t set individual calls for individual subscribers or even groups, and they also said in the store that a flash drive is included, no"
218,3050301,1637,1621,2013-10-01,"Антивирус AVG просто супер. Пользуюсь им уже два года. Защищает практически от всего, что есть плохого в глобальной сети. Рекомендую всем именно его.",5,positive,AVG antivirus is just super. I&#39;ve been using it for two years now. It protects from almost everything that is bad on the global network. I recommend it to everyone.
303,3030501,1542,2923,2011-06-29,"Играл минут 30.  Первое впечатление от игры - не плохое, ну и не шикарное, многие хвалили её до ужаса. Я ничего особенного не увидел. Может быть в дальнейшем моё мнение изменится.",4,positive,"Played for about 30 minutes. First impression of the game - not bad, well and not great, many praised it to horror. I did not see anything special. Maybe in the future my opinion will change."
203,2030301,93,2721,2010-05-08,"Хороший системник, мощный,быстрый и не занимает много места как другие. Процессоры новой серии i3, частота вообще не реальная 2.93Ггц, видео карта GeForce GT320 тоже новая и жестокая память видюхи 1024 мб хватает всего с головой, игра никакая не глючит, даже последняя, но xbox 360 лучше и мощнее и быстрее, игру устанавливает за 1 минуту xbox 360, но он ведь для этого и предназначен. Acer тоже нехилый, устанавливает за 7 минут, короче, для всего хорош.=)",5,positive,"A good system unit, powerful, fast and does not take up much space like others. Processors of the new i3 series, the frequency is not at all real 2.93 GHz, the GeForce GT320 video card is also new and brutal, the video card memory is 1024 MB, there is more than enough memory, no game glitches, even the latest one, but the Xbox 360 is better and more powerful and faster, the game installs in 1 minute Xbox 360, but that&#39;s what it is designed for. Acer is also not bad, it installs in 7 minutes, in short, it is good for everything. =)"
103,1030804,1339,1226,2010-12-28,Хороший товар.  Удобно то что можно заряжать в машине.  Недостатки: в принципе незначительные. Нужно 4 аккумулятора на одно устройство. Гарнитура не в комплекте.,5,positive,"Good product. Conveniently, you can charge it in the car. Disadvantages: basically insignificant. You need 4 batteries for one device. Headset is not included."
411,4110102,13,655,2011-07-07,"Мне лично понравился дизайн пылесоса маленький и удобный купил полгода назад тоже доволен пылесосом .. тем что без мешков, но минус это промывка фильтров есть такая тема но это делается не каждый раз,а раз в месяц. Тяга отличная. понравилось ещё трубка раскидная т.е. настраиваешь её под свой рост.",4,positive,"I personally liked the design of the vacuum cleaner, it is small and convenient, I bought it six months ago, I am also happy with the vacuum cleaner... the fact that it is bagless, but the downside is that you have to wash the filters, there is such a topic, but this is not done every time, but once a month. The draft is excellent. I also liked the folding tube, i.e. you adjust it to your height."
