item_category,item_id,brand,user_id,date,comment,rating,tonality,translated_comment
107,1070902,13,2387,2010-04-15,"ЖК-телевизор 32"" Samsung LE-32 B450 C4W. Отличный телевизор, на мой взгляд - лучший из ""бюджетных"" моделей. Яркое, сочное, ""солнечное"" изображение, которое действительно порадовало!!! Матрица Самсунг - рулит! Диагональ - меньше 26"" я даже не рассматривала при выборе, а вкусив 32"" - на меньшую вы уже и не согласитесь (если только этот телевизор не будет предназначаться для кухни, например). Так что советую всем сомневающимся! Берите - не пожалеете!",5,positive,"LCD TV 32&quot; Samsung LE-32 B450 C4W. Excellent TV, in my opinion - the best of the &quot;budget&quot; models. Bright, juicy, &quot;sunny&quot; image, which really pleased!!! Samsung matrix - rules! Diagonal - less than 26&quot; I did not even consider when choosing, and having tasted 32&quot; - you will not agree to less (unless this TV is intended for the kitchen, for example). So I advise all doubters! Take - you will not regret!"
107,1070902,13,257,2010-06-07,"Здравствуйте,подскажите пожалуйста как убрать звук при включении и выключении телевизора?Перелистала всю книжку по руководству,так и не нашла.Буду вам очень благодарна если подскажите.А в общем телевизор меня устраивает.С уважением.",4,positive,"Hello, please tell me how to turn off the sound when turning the TV on and off? I&#39;ve looked through the entire manual and still haven&#39;t found it. I&#39;d be very grateful if you could tell me. In general, the TV suits me. Best regards."
304,3040105,1,783,2011-09-26,"Если вам не нравится эта консоль,то это потому что она не похожа на другие,но заметьте что это самая портативная псп из всех псп!",5,positive,"If you don&#39;t like this console, it&#39;s because it&#39;s not like the others, but note that this is the most portable PSP of all PSPs!"
107,1070902,13,2656,2009-10-18,"Отличная панель,звук,изображение на отлично.Хотел взять филипс но качество тв сигнала плохое(пока не сравнил с данной панелью).Не сколько не пожалел что взял именно эту модель,да и цена приемлема.",5,positive,"Excellent panel, sound, picture are excellent. I wanted to take Philips but the quality of the TV signal is bad (I haven&#39;t compared it with this panel yet). I don&#39;t regret at all that I took this model, and the price is acceptable."
207,2070202,1,2506,2011-06-27,"купил три дня назад порадовало качество звука , ёмкость аккумулятора и цена . минус - это наушники , поэтому сразу купил Sennheiser CX-300-ll Black .",5,positive,"I bought it three days ago, I was pleased with the sound quality, battery capacity and price. The downside is the headphones, so I immediately bought Sennheiser CX-300-ll Black."
203,2030201,19,2151,2009-10-17,"Машинка хорошая, приобрел 10.10.2009, перед этим глаз положил на Acer? но так как из рук прям вырвали и не успел купить, то искал близкий по параметрам, который и оказался Toshiba. Характеристики очень порадовали, для ноута хорошо справляется с современными играми, система охлаждения работает как часы, что положительно сказывается на производительности. Ноут сделан для людей следящих за своим стилем и выглядит как машинка для состоятельного руководителя, единственно приходится его протирать почаще.  Матрица очень четкая и с хорошим откликом, чем почти уступает новой светодиодной матрице по контрастности цветов. Вес в отличии от Acer самый оптимальный, на целый кг легче, что намного удобнее при работе на коленках. А главное сделан этично и эргономично, ничего лишнего.   Очень хорошо показала себя звуковая система которая способна воспроизводить широкополосные композиции.",5,positive,"The machine is good, I bought it on 10.10.2009, before that I had my eye on Acer? but since it was snatched out of my hands and I didn&#39;t have time to buy it, I looked for something close in parameters, which turned out to be Toshiba. The characteristics were very pleasing, for a laptop it copes well with modern games, the cooling system works like a clock, which has a positive effect on performance. The laptop is made for people who follow their style and looks like a machine for a wealthy manager, the only thing is that you have to wipe it more often. The matrix is very clear and with a good response, which is almost inferior to the new LED matrix in terms of color contrast. The weight, unlike Acer, is the most optimal, a whole kg lighter, which is much more convenient when working on your lap. And most importantly, it is made ethically and ergonomically, nothing superfluous. The sound system, which is capable of reproducing broadband compositions, has proven itself very well."
107,1070902,80,2879,2011-07-07,"Очень долго выбирал какой именно купить телевизор, но остановился на этой модели. Он достоен оценки 5+, картинка яркая и чёткая, читает множество форматов с USB флэшек, вообще за эти деньги лучше не найти.",5,positive,"I spent a long time choosing which TV to buy, but settled on this model. It deserves a 5+ rating, the picture is bright and clear, reads many formats from USB flash drives, you won&#39;t find anything better for this money."
107,1070903,11,2066,2010-02-26,"Как к этому телевизору подключить цифровое телевидение?  Декодер ставить совсем не хочу, а CAM незнаю куда вставлять, слота для карточки нет. Может тут вообще встроенный декодер а? Помогите решить вопрос плиз))",5,positive,"How can I connect digital television to this TV? I don&#39;t want to install a decoder at all, and I don&#39;t know where to insert a CAM, there is no slot for a card. Maybe there is a built-in decoder here? Help me solve this problem, please))"
203,2030201,534,1565,2010-05-22,"Тоже полностью доволен ноутбуком, вот только одна проблема возникла...  Никак не могу понять ЧТО ДЕЛАТЬ со звуком.. Втыкаю наушники, но звук всё-равно играет из колонок... В настройках... не ставится по умолчанию звук на наушники...  Зато когда звоню с телефонного модема.. звук идёт на наушники.",5,positive,"I am also completely satisfied with the laptop, but there is just one problem... I can&#39;t figure out WHAT TO DO with the sound.. I plug in the headphones, but the sound still comes out of the speakers... In the settings... the sound is not set to the headphones by default... But when I call from a telephone modem.. the sound goes to the headphones."
103,1030304,592,2937,2009-08-07,"Вы знаете я приобрёл Автомобильную магнитолу с DVD + монитор Prology DVS-1350 Всё отлично,всё радует, звук ,изображение,но мне не понятно почему такой плохой тюнер,ни одна радиостанция чётко не работает. У меня до этого была JVC правда простая без DVD без флеш-карты,радио станции ловила отлично,а здесь не пойму в чём причина,если кто знает,прошу ответить.  мой email:Kuvaeff_roman@mail.ru",4,positive,"You know, I bought a car radio with DVD + monitor Prology DVS-1350 Everything is great, everything pleases, sound, image, but I don’t understand why such a bad tuner, not a single radio station works clearly. Before that, I had a JVC, though simple, without DVD, without a flash card, it caught radio stations perfectly, but here I don’t understand what the reason is, if anyone knows, please answer. My email: Kuvaeff_roman@mail.ru"
405,4050206,979,1662,2012-07-16,"Привет всем, хочу оставить хороший отзыв на етот прибор. Во первых - цена уже о многом говорит, расход воды и электроэнергии для проточного водонагревателя низкие, а главное установите прибор сразу к стене, а то я первый спалил положив горизонтально.  Сейчас пользую в дни когда отключают горячую воду, Однозначно пользоваться прибором выгодней, чем греть кастрюли!",4,positive,"Hello everyone, I want to leave a good review of this device. Firstly, the price already says a lot, the water and electricity consumption for a flow-through water heater is low, and most importantly, install the device directly to the wall, otherwise I burned the first one by laying it horizontally. Now I use it on days when the hot water is turned off. It is definitely more profitable to use the device than to heat pots!"
203,2030201,995,2387,2010-08-24,"Ноут просто супер, летает, работает без тормазов. Клавиатура удобная.",5,positive,"The laptop is just super, flies, works without any lags. The keyboard is comfortable."
410,4100301,48,1247,2016-08-29,"Плюсы: компактная, удобна в обращении, не коксует кофе под ножом  Минусы: разве что чуть шумновата  Общие впечатления- работает около 6 лет. Ежедневно по 2-3 раза с месячным помолом около килограмма зерна. На сегодня, с учётом отпусков и прочих отсутствий по моим подсчетам намолото около 70 кг) читайте инструкцию, обращайтесь аккуратно и да будет вам кофейное счастье.",5,positive,"Pros: compact, easy to use, does not coke the coffee under the knife Cons: maybe a little noisy General impressions - it has been working for about 6 years. Daily 2-3 times with a monthly grinding of about a kilogram of beans. As of today, taking into account vacations and other absences, according to my calculations, about 70 kg have been ground) read the instructions, handle carefully and may you have coffee happiness."
401,4010501,81,2305,2016-10-28,"Не сомневалась давно в качестве Электролюкс, так что из-за бренда покупала эту стиральную машину. Мы разместили ее у нас на кухне, хорошо вписалась, к тому же у нее есть собственная дверца. Мне очень понравились функции ручной стирки шерсти и шелка, одежда совершенно не портится и не растягивается. Часто пользуюсь разрыхлением после отжима, так намного легче потом доставать одежду и развешивать ее, а то отжим тут приличный, одежда после него быстро сушится. Система безопасности тут хорошо продумана, есть и защита от детей, и контроль дисбаланса и самодиагностика неисправностей.",4,positive,"I have long had no doubts about the quality of Electrolux, so I bought this washing machine because of the brand. We placed it in our kitchen, it fits well, and it has its own door. I really liked the hand wash functions for wool and silk, the clothes are not damaged or stretched at all. I often use the loosening after spinning, it makes it much easier to take out clothes and hang them up, because the spin here is decent, the clothes dry quickly after it. The safety system here is well thought out, there is child protection, imbalance control and self-diagnosis of malfunctions."
410,4100201,64,837,2012-11-27,"1)В ней есть что надо за такую цену. 2)Все манипуляции с чисткой, заправкой, обслуживание производятся спереди, поэтому можно устанавливать в ряд с другой техникой микроволновкой, комбайном и т.д., большой бак для воды. 3)Пенку взбивает очень плотную, молоко 3,5% Милок увеличивается раза в три. 4)кофе крепкий, пришлось уменьшить регулировку крепости, поставив дозатор посередине. 5)Удобный столик для чашек сверху. 6)Настоящая итальянка. Упакован в двойной коробке, внешняя - вся итальянская с их наклейками, штрих-кодами и т.д., видимо только с дороги. 7)Думаю, ещё найду. Недостатки как таковых пока не заметил, вот только нагрев столика особо не почувствовал. Ну и если не брать в расчёт неправильное описание, устаревшая фотография на оф.сайте, Яндексе да и во всей сети. Долго выбирал, когда остановился на Делонге, начал метаться по моделям, их огромный выбор. Потратил два дня, в итоге выбрал эту. При звонке в интернет-магазин мне объяснили,что оказывается все модели до 30000 рублей одинаковые,разница только в дизайне и наличие дисплея. Информация на оф.сайте устаревшая, включая инструкции и фотографии блуждающие по интернету. На самом деле на этой модели вместо кнопки с краником - кнопка пар как и у всех(в процессе выбора меня этот краник отпугивал отсутствием функции быстрый пар, что и до сих пор подтверждается на сайте), а вместо кнопки ложка-появилась кнопка ECO. Таким образом машина сравнялась по функциям со старшими собратьями, вышла,т.с., на современный уровень. Нормальный быстрый пар, программирование времени отключения, вопреки описанию на оф.сайте, появился выключатель на задней стенке. Инструкция в комплекте правильная, а не та устаревшая, что с оф. сайта, если хотите почитать правильную, качайте от более старшей модели, все кнопки и функции одни и те же, машины одинаковые. Очень советую покупать, красивая,компактная,удобная и стильная модель с функциями как у дорогих моделей. P/S/ В инструкции понравилась фраза в самом начале Уделите ПАРУ МИНУТ на чтение данных инструкции :-)), читал намного дольше,а разбирался с настройкам тоже долго,т.к. их масса.",5,positive,"1) It has what you need for such a price. 2) All manipulations with cleaning, filling, maintenance are carried out from the front, so it can be installed in a row with other equipment (microwave, food processor, etc.), large water tank. 3) It whips up very thick foam, 3.5% Milk increases milk three times. 4) The coffee is strong, I had to reduce the strength adjustment, putting the dispenser in the middle. 5) Convenient table for cups on top. 6) A real Italian. Packed in a double box, the outer one is all Italian with their stickers, barcodes, etc., apparently just from the road. 7) I think I&#39;ll find more. I haven&#39;t noticed any disadvantages as such yet, only I didn&#39;t really feel the heating of the table. Well, if you don&#39;t take into account the incorrect description, outdated photo on the official website, Yandex and the entire network. I spent a long time choosing, when I settled on Delong, I started rushing around the models, their selection is huge. I spent two days, and eventually chose this one. When I called the online store, they explained to me that it turns out that all models up to 30,000 rubles are the same, the only difference is in the design and the presence of a display. The information on the official website is outdated, including instructions and photos wandering around the Internet. In fact, this model has a steam button instead of a button with a tap, like everyone else (during the selection process, this tap scared me off due to the lack of a fast steam function, which is still confirmed on the website), and instead of a spoon button, an ECO button appeared. Thus, the machine is on par with its older brothers in terms of functions, and has reached, so to speak, a modern level. Normal fast steam, programming of the shutdown time, contrary to the description on the official website, a switch appeared on the back wall. The instructions included are correct, and not the outdated ones from the official website. site, if you want to read the correct one, download from an older model, all the buttons and functions are the same, the machines are the same. I highly recommend buying it, it&#39;s a beautiful, compact, comfortable and stylish model with functions like expensive models. P/S/ I liked the phrase at the very beginning of the instructions: Take a COUPLE OF MINUTES to read these instructions :-)), it took me much longer to read, and it took me a long time to figure out the settings, because there are a lot of them."
406,4061001,48,1217,2010-03-06,"У меня больше трех лет два подобных чайника (такой+ Сименс-близнец). Никак не сломаются. Один действительно стал лить мимо после того, как был залит выше отметки Мах, верх колбы похоже слегка деформировался от нагрева. Был отправлен на дачу.",4,positive,"I have had two similar kettles for over three years (this one + a Siemens twin). They never break. One actually started pouring incorrectly after it was filled above the Max mark, the top of the flask seemed to have slightly deformed from the heat. It was sent to the country."
304,3040304,1,2923,2009-12-17,"Сын просил это чудо на новый год, но я купил ему на шестнадцатилетие, он оооочень доволен. Очень удобная вещь, без проблем подключается к беспроводным сетям, так что почти везде есть интернет+ возможность общаться через Skype, докупили через интернет GPS модуль(маленький как карточки памти memorystick) теперь берем ее с собой когда едем за границу или в соседний город- очень помогает сориентироваться!  Всем советую приобрести!Если есть дети, то тем более.",5,positive,"My son asked for this miracle for the New Year, but I bought it for him for his sixteenth birthday, he is sooooo happy. A very convenient thing, it connects to wireless networks without any problems, so there is Internet almost everywhere + the ability to communicate via Skype, we also bought a GPS module via the Internet (small like a memory stick), now we take it with us when we go abroad or to a neighboring city - it really helps us get our bearings! I advise everyone to buy it! If you have children, then even more so."
107,1070903,1,1417,2010-03-01,"Пользуюсь две недели, телевизор очень порадовал.  Плюсы: очень насыщенный и глубокий черный цвет, хорошая контрастность и сочность картинки, возможность подключения к ПК по DSub и DVI-HDMI, много разных входных разъемов, включая USB, обновляемая прошивка, звук очень приличный, никаких вибраций не замечено.  Минусы: немного шатается взад-вперед на подставке, но вроде не так сильно как у самсунгов. Настройки громкости едины для всех входящих разъемов, т.е. при переключении с компьютера на антенну рано утром может сильно заорать. Нельзя сделать для каждого канала ТВ свои настройки изображения (цветность, контрастность, теплота цвета), а так же формата изображения (16:9, 4:3 и т.д.).  По соотношению цена/качество, удобству использования и дизайну - телевизор отличный, качество картинки не хуже, чем у тех, что в два раза дороже.",5,positive,"I have been using it for two weeks, and I am very pleased with the TV. Pros: very rich and deep black color, good contrast and richness of the picture, the ability to connect to a PC via DSub and DVI-HDMI, many different input connectors, including USB, updatable firmware, the sound is very decent, no vibrations were noticed. Cons: it wobbles back and forth on the stand a little, but it seems not as much as with Samsungs. The volume settings are the same for all input connectors, i.e. when switching from a computer to an antenna early in the morning it can scream loudly. It is impossible to make individual image settings (color, contrast, color warmth), as well as image format (16:9, 4:3, etc.) for each TV channel. In terms of price/quality ratio, ease of use and design, the TV is excellent, the picture quality is no worse than those that are twice as expensive."
413,4130401,63,576,2010-12-14,"Фен отличный! Быстро сушит волосы (достаточно мощный), легкий для руки и удобен тем, что у него прорезиненый корпус - из рук не выскальзывает. Пользуюсь уже 3-й год ежедневно и никаких проблем не испытываю. Не жужжит, не скрипит и ничего не отвалилось, хотя постоянно беру его с собой в поездки.",5,positive,"The hair dryer is excellent! It dries hair quickly (it is quite powerful), it is light in the hand and convenient because it has a rubberized body - it does not slip out of your hands. I have been using it for 3 years now every day and have not experienced any problems. It does not buzz, does not creak and nothing has fallen off, although I constantly take it with me on trips."
413,4130401,63,2217,2017-05-09,Удобный в эксплуатации,4,positive,Easy to operate
